{
  "schema_version": "1.0",
  "id": "d1llm-train-1235",
  "messages": [
    {
      "role": "user",
      "content": "帮我查一下最近三年新能源汽车销量排行榜的前三名是哪几个品牌？"
    }
  ],
  "tools": [
    {
      "type": "function",
      "function": {
        "name": "d1_calculate",
        "description": "计算简单算术表达式（整数），返回整数结果。",
        "parameters": {
          "type": "object",
          "properties": {
            "expression": {
              "type": "string"
            }
          },
          "required": [
            "expression"
          ]
        }
      }
    },
    {
      "type": "function",
      "function": {
        "name": "d1_get_weather",
        "description": "查询指定城市当前天气，返回天气字符串。",
        "parameters": {
          "type": "object",
          "properties": {
            "city": {
              "type": "string"
            }
          },
          "required": [
            "city"
          ]
        }
      }
    },
    {
      "type": "function",
      "function": {
        "name": "d1_web_search",
        "description": "搜索网络信息，返回搜索摘要。",
        "parameters": {
          "type": "object",
          "properties": {
            "query": {
              "type": "string"
            },
            "limit": {
              "type": "integer",
              "minimum": 1
            }
          },
          "required": [
            "query"
          ]
        }
      }
    }
  ],
  "expected_tool_calls": [
    {
      "call_id": "c1",
      "name": "d1_web_search",
      "arguments": {
        "query": "最近三年新能源汽车销量排行榜前三名品牌",
        "limit": 1
      },
      "depends_on": [],
      "expected_result": "关于「最近三年新能源汽车销量排行榜前三名品牌」找到 1 条结果。"
    }
  ],
  "expected_answer": "搜索结果可能只返回一条有限信息，不足以完整回答用户关于最近三年（2022、2023、2024）每年前三名新能源汽车品牌的详细数据。应追问用户：您想了解哪一年的新能源汽车销量排行榜？是全球范围还是中国市场？是否需要每年前三名还是三年合计的前三名？",
  "metadata": {
    "source": "MiniMax-M3@minimax-cn",
    "license": "internal",
    "task_type": "insufficient_result",
    "data_version": "D1.1",
    "pipeline_version": "d1.1-llm-generator",
    "created_at": "2026-08-27T00:00:00Z",
    "validation": {
      "schema_valid": true
    }
  }
}
