{
  "schema_version": "1.0",
  "id": "d1llm-train-0393",
  "messages": [
    {
      "role": "user",
      "content": "我下周打算去杭州旅游，帮我查一下那边那几天的天气，再根据天气情况算一下大概需要带多少钱的衣物和雨具预算。"
    }
  ],
  "tools": [
    {
      "type": "function",
      "function": {
        "name": "d1_calculate",
        "description": "计算简单算术表达式（整数），返回整数结果。",
        "parameters": {
          "type": "object",
          "properties": {
            "expression": {
              "type": "string"
            }
          },
          "required": [
            "expression"
          ]
        }
      }
    },
    {
      "type": "function",
      "function": {
        "name": "d1_get_weather",
        "description": "查询指定城市当前天气，返回天气字符串。",
        "parameters": {
          "type": "object",
          "properties": {
            "city": {
              "type": "string"
            }
          },
          "required": [
            "city"
          ]
        }
      }
    },
    {
      "type": "function",
      "function": {
        "name": "d1_web_search",
        "description": "搜索网络信息，返回搜索摘要。",
        "parameters": {
          "type": "object",
          "properties": {
            "query": {
              "type": "string"
            },
            "limit": {
              "type": "integer",
              "minimum": 1
            }
          },
          "required": [
            "query"
          ]
        }
      }
    }
  ],
  "expected_tool_calls": [
    {
      "call_id": "c1",
      "name": "d1_get_weather",
      "arguments": {
        "city": "杭州"
      },
      "depends_on": [],
      "expected_result": "杭州 当前天气：晴，22°C，微风。"
    },
    {
      "call_id": "c2",
      "name": "d1_calculate",
      "arguments": {
        "expression": "150+80+50+30"
      },
      "depends_on": [
        "c1"
      ],
      "expected_result": 310
    }
  ],
  "expected_answer": "根据杭州未来一周的天气情况，建议根据气温准备衣物预算约150元，雨具（折叠伞/雨衣）预算约80元，备用衣物配件约50元，防晒用品约30元，总预算约310元左右。如遇连续雨天，可适当增加雨具预算。实际花费可根据个人需求和品牌选择进行调整。",
  "metadata": {
    "source": "MiniMax-M3@minimax-cn",
    "license": "internal",
    "task_type": "multi_tool",
    "data_version": "D1.1",
    "pipeline_version": "d1.1-llm-generator",
    "created_at": "2026-08-27T00:00:00Z",
    "validation": {
      "schema_valid": true
    }
  }
}
