{
  "schema_version": "1.0",
  "id": "d1llm-train-0287",
  "messages": [
    {
      "role": "user",
      "content": "推荐一部适合周末在家看的悬疑类电视剧，不要太老的，近几年的最好。"
    }
  ],
  "tools": [
    {
      "type": "function",
      "function": {
        "name": "d1_calculate",
        "description": "计算简单算术表达式（整数），返回整数结果。",
        "parameters": {
          "type": "object",
          "properties": {
            "expression": {
              "type": "string"
            }
          },
          "required": [
            "expression"
          ]
        }
      }
    },
    {
      "type": "function",
      "function": {
        "name": "d1_get_weather",
        "description": "查询指定城市当前天气，返回天气字符串。",
        "parameters": {
          "type": "object",
          "properties": {
            "city": {
              "type": "string"
            }
          },
          "required": [
            "city"
          ]
        }
      }
    },
    {
      "type": "function",
      "function": {
        "name": "d1_web_search",
        "description": "搜索网络信息，返回搜索摘要。",
        "parameters": {
          "type": "object",
          "properties": {
            "query": {
              "type": "string"
            },
            "limit": {
              "type": "integer",
              "minimum": 1
            }
          },
          "required": [
            "query"
          ]
        }
      }
    }
  ],
  "expected_tool_calls": [
    {
      "call_id": "c1",
      "name": "d1_web_search",
      "arguments": {
        "query": "近几年悬疑电视剧推荐 适合周末看",
        "limit": 5
      },
      "depends_on": [],
      "expected_result": "关于「近几年悬疑电视剧推荐 适合周末看」找到 5 条结果。"
    }
  ],
  "expected_answer": "根据搜索结果，推荐近几年的悬疑类电视剧。搜索结果有限，应主动询问用户偏好（如国产/海外、短剧/长剧、惊悚/烧脑方向等），以便进一步精准推荐。",
  "metadata": {
    "source": "MiniMax-M3@minimax-cn",
    "license": "internal",
    "task_type": "insufficient_result",
    "data_version": "D1.1",
    "pipeline_version": "d1.1-llm-generator",
    "created_at": "2026-08-27T00:00:00Z",
    "validation": {
      "schema_valid": true
    }
  }
}
