{
  "schema_version": "1.0",
  "id": "d1-0038",
  "messages": [
    {
      "role": "system",
      "content": "You are a helpful assistant with tool access."
    },
    {
      "role": "user",
      "content": "先计算 12 + 87，再搜索一下 RTX 5070 Ti 规格。"
    }
  ],
  "tools": [
    {
      "type": "function",
      "function": {
        "name": "d1_calculate",
        "description": "Evaluate a simple arithmetic expression on integers.",
        "parameters": {
          "type": "object",
          "properties": {
            "expression": {
              "type": "string"
            }
          },
          "required": [
            "expression"
          ]
        }
      }
    },
    {
      "type": "function",
      "function": {
        "name": "d1_web_search",
        "description": "Search the web for information.",
        "parameters": {
          "type": "object",
          "properties": {
            "query": {
              "type": "string"
            },
            "limit": {
              "type": "integer",
              "minimum": 1
            }
          },
          "required": [
            "query"
          ]
        }
      }
    }
  ],
  "expected_tool_calls": [
    {
      "call_id": "call-d1-0038-a",
      "name": "d1_calculate",
      "arguments": {
        "expression": "12 + 87"
      },
      "expected_result": 99
    },
    {
      "call_id": "call-d1-0038-b",
      "name": "d1_web_search",
      "arguments": {
        "query": "RTX 5070 Ti 规格"
      },
      "depends_on": [
        "call-d1-0038-a"
      ],
      "expected_result": "关于「RTX 5070 Ti 规格」找到 3 条结果。"
    }
  ],
  "expected_answer": "计算结果：99；搜索结果：关于「RTX 5070 Ti 规格」找到 3 条结果。",
  "metadata": {
    "source": "d1-synthetic-template",
    "license": "project-internal",
    "task_type": "multi_tool",
    "task_template": "multi_calc_search",
    "data_version": "D1",
    "pipeline_version": "p1-05-d1-generator",
    "created_at": "2026-08-27T00:00:00Z",
    "validation": {
      "schema_valid": true,
      "tool_execution_valid": null,
      "answer_valid": null,
      "quality_passed": null
    }
  }
}
