{
  "schema_version": "1.0",
  "id": "d1llm-train-0811",
  "messages": [
    {
      "role": "user",
      "content": "帮我解释一下\"内卷\"这个词到底是什么意思，最近老听人说起。"
    }
  ],
  "tools": [
    {
      "type": "function",
      "function": {
        "name": "d1_calculate",
        "description": "计算简单算术表达式（整数），返回整数结果。",
        "parameters": {
          "type": "object",
          "properties": {
            "expression": {
              "type": "string"
            }
          },
          "required": [
            "expression"
          ]
        }
      }
    },
    {
      "type": "function",
      "function": {
        "name": "d1_get_weather",
        "description": "查询指定城市当前天气，返回天气字符串。",
        "parameters": {
          "type": "object",
          "properties": {
            "city": {
              "type": "string"
            }
          },
          "required": [
            "city"
          ]
        }
      }
    },
    {
      "type": "function",
      "function": {
        "name": "d1_web_search",
        "description": "搜索网络信息，返回搜索摘要。",
        "parameters": {
          "type": "object",
          "properties": {
            "query": {
              "type": "string"
            },
            "limit": {
              "type": "integer",
              "minimum": 1
            }
          },
          "required": [
            "query"
          ]
        }
      }
    }
  ],
  "expected_tool_calls": [],
  "expected_answer": "\"内卷\"原本是学术概念，指一种文化模式在发展到一定阶段后无法继续升级，只能在内部不断复杂化、精细化。如今在网络语境中，它被引申为：在有限资源下，个体或群体为了竞争而不断增加投入（时间、精力等），但收益并未同比增长，导致恶性竞争和无效内耗。常见例子如\"加班越来越久但产出没有相应增加\"、\"学生刷题越来越多但分数提升有限\"等。简单说就是：付出越来越多，回报却没变，甚至越来越累。",
  "metadata": {
    "source": "MiniMax-M3@minimax-cn",
    "license": "internal",
    "task_type": "no_tool",
    "data_version": "D1.1",
    "pipeline_version": "d1.1-llm-generator",
    "created_at": "2026-08-27T00:00:00Z",
    "validation": {
      "schema_valid": true
    }
  }
}
