{
  "schema_version": "1.0",
  "id": "d1llm-train-1017",
  "messages": [
    {
      "role": "user",
      "content": "帮我查一下杭州今天的天气，再根据这个温度算算如果要把20升水从25度加热到这个温度，需要多少千瓦时的电（加热效率按90%算）？"
    }
  ],
  "tools": [
    {
      "type": "function",
      "function": {
        "name": "d1_calculate",
        "description": "计算简单算术表达式（整数），返回整数结果。",
        "parameters": {
          "type": "object",
          "properties": {
            "expression": {
              "type": "string"
            }
          },
          "required": [
            "expression"
          ]
        }
      }
    },
    {
      "type": "function",
      "function": {
        "name": "d1_get_weather",
        "description": "查询指定城市当前天气，返回天气字符串。",
        "parameters": {
          "type": "object",
          "properties": {
            "city": {
              "type": "string"
            }
          },
          "required": [
            "city"
          ]
        }
      }
    },
    {
      "type": "function",
      "function": {
        "name": "d1_web_search",
        "description": "搜索网络信息，返回搜索摘要。",
        "parameters": {
          "type": "object",
          "properties": {
            "query": {
              "type": "string"
            },
            "limit": {
              "type": "integer",
              "minimum": 1
            }
          },
          "required": [
            "query"
          ]
        }
      }
    }
  ],
  "expected_tool_calls": [
    {
      "call_id": "c1",
      "name": "d1_get_weather",
      "arguments": {
        "city": "杭州"
      },
      "depends_on": [],
      "expected_result": "杭州 当前天气：晴，22°C，微风。"
    },
    {
      "call_id": "c2",
      "name": "d1_calculate",
      "arguments": {
        "expression": "20 * 4.18 * (40 - 25) / (0.9 * 3600)"
      },
      "depends_on": [
        "c1"
      ],
      "expected_result": 0
    }
  ],
  "expected_answer": "先查询杭州今日天气，获取当前温度（假设为T度），然后用公式 20×4.18×(T-25)/(0.9×3600) 计算所需电量。例如若杭州今天40度，则需要 20×4.18×15÷(0.9×3600) ≈ 0.3878 千瓦时。",
  "metadata": {
    "source": "MiniMax-M3@minimax-cn",
    "license": "internal",
    "task_type": "multi_tool",
    "data_version": "D1.1",
    "pipeline_version": "d1.1-llm-generator",
    "created_at": "2026-08-27T00:00:00Z",
    "validation": {
      "schema_valid": true
    }
  }
}
