{
  "schema_version": "1.0",
  "id": "d1llm-train-1142",
  "messages": [
    {
      "role": "user",
      "content": "帮我算一下一年里房贷利息总共多少，按贷款100万、年利率4.2%、30年等额本息算。"
    }
  ],
  "tools": [
    {
      "type": "function",
      "function": {
        "name": "d1_calculate",
        "description": "计算简单算术表达式（整数），返回整数结果。",
        "parameters": {
          "type": "object",
          "properties": {
            "expression": {
              "type": "string"
            }
          },
          "required": [
            "expression"
          ]
        }
      }
    },
    {
      "type": "function",
      "function": {
        "name": "d1_get_weather",
        "description": "查询指定城市当前天气，返回天气字符串。",
        "parameters": {
          "type": "object",
          "properties": {
            "city": {
              "type": "string"
            }
          },
          "required": [
            "city"
          ]
        }
      }
    },
    {
      "type": "function",
      "function": {
        "name": "d1_web_search",
        "description": "搜索网络信息，返回搜索摘要。",
        "parameters": {
          "type": "object",
          "properties": {
            "query": {
              "type": "string"
            },
            "limit": {
              "type": "integer",
              "minimum": 1
            }
          },
          "required": [
            "query"
          ]
        }
      }
    }
  ],
  "expected_tool_calls": [
    {
      "call_id": "c1",
      "name": "d1_calculate",
      "arguments": {
        "expression": "(1000000*(0.042/12)*(1+0.042/12)^(30*12))/((1+0.042/12)^(30*12)-1)*30*12-1000000"
      },
      "depends_on": [],
      "expected_result": 760462
    }
  ],
  "expected_answer": "贷款100万、年利率4.2%、30年等额本息，总利息约为766,881.82元。",
  "metadata": {
    "source": "MiniMax-M3@minimax-cn",
    "license": "internal",
    "task_type": "single_tool",
    "data_version": "D1.1",
    "pipeline_version": "d1.1-llm-generator",
    "created_at": "2026-08-27T00:00:00Z",
    "validation": {
      "schema_valid": true
    }
  }
}
