{
  "schema_version": "1.0",
  "id": "d1llm-train-0449",
  "messages": [
    {
      "role": "user",
      "content": "帮我查一下最近那个很火的AI模型是什么，顺便看看它跟之前的比有什么突破"
    }
  ],
  "tools": [
    {
      "type": "function",
      "function": {
        "name": "d1_calculate",
        "description": "计算简单算术表达式（整数），返回整数结果。",
        "parameters": {
          "type": "object",
          "properties": {
            "expression": {
              "type": "string"
            }
          },
          "required": [
            "expression"
          ]
        }
      }
    },
    {
      "type": "function",
      "function": {
        "name": "d1_get_weather",
        "description": "查询指定城市当前天气，返回天气字符串。",
        "parameters": {
          "type": "object",
          "properties": {
            "city": {
              "type": "string"
            }
          },
          "required": [
            "city"
          ]
        }
      }
    },
    {
      "type": "function",
      "function": {
        "name": "d1_web_search",
        "description": "搜索网络信息，返回搜索摘要。",
        "parameters": {
          "type": "object",
          "properties": {
            "query": {
              "type": "string"
            },
            "limit": {
              "type": "integer",
              "minimum": 1
            }
          },
          "required": [
            "query"
          ]
        }
      }
    }
  ],
  "expected_tool_calls": [
    {
      "call_id": "c1",
      "name": "d1_web_search",
      "arguments": {
        "query": "最近最火的AI模型"
      },
      "depends_on": [],
      "expected_result": "关于「最近最火的AI模型」找到 3 条结果。"
    },
    {
      "call_id": "c2",
      "name": "d1_web_search",
      "arguments": {
        "query": "最新AI模型突破和之前的对比"
      },
      "depends_on": [],
      "expected_result": "关于「最新AI模型突破和之前的对比」找到 3 条结果。"
    }
  ],
  "expected_answer": "搜索结果数量有限，无法明确确定用户所指的'最近那个很火的AI模型'具体是哪一款（可能是DeepSeek、GPT、Claude等中的某一个），模型应向用户追问具体指的是哪个AI模型，以便提供更精准的突破对比信息。",
  "metadata": {
    "source": "MiniMax-M3@minimax-cn",
    "license": "internal",
    "task_type": "insufficient_result",
    "data_version": "D1.1",
    "pipeline_version": "d1.1-llm-generator",
    "created_at": "2026-08-27T00:00:00Z",
    "validation": {
      "schema_valid": true
    }
  }
}
