{
  "schema_version": "1.0",
  "id": "d1llm-train-0985",
  "messages": [
    {
      "role": "user",
      "content": "推荐一些适合周末在家做的简单家常菜吧，最好是有具体步骤的那种。"
    }
  ],
  "tools": [
    {
      "type": "function",
      "function": {
        "name": "d1_calculate",
        "description": "计算简单算术表达式（整数），返回整数结果。",
        "parameters": {
          "type": "object",
          "properties": {
            "expression": {
              "type": "string"
            }
          },
          "required": [
            "expression"
          ]
        }
      }
    },
    {
      "type": "function",
      "function": {
        "name": "d1_get_weather",
        "description": "查询指定城市当前天气，返回天气字符串。",
        "parameters": {
          "type": "object",
          "properties": {
            "city": {
              "type": "string"
            }
          },
          "required": [
            "city"
          ]
        }
      }
    },
    {
      "type": "function",
      "function": {
        "name": "d1_web_search",
        "description": "搜索网络信息，返回搜索摘要。",
        "parameters": {
          "type": "object",
          "properties": {
            "query": {
              "type": "string"
            },
            "limit": {
              "type": "integer",
              "minimum": 1
            }
          },
          "required": [
            "query"
          ]
        }
      }
    }
  ],
  "expected_tool_calls": [],
  "expected_answer": "为用户推荐几道适合周末在家做的简单家常菜，并附上具体的制作步骤，例如：番茄炒蛋（鸡蛋打散加少许盐，番茄切块，热油先炒蛋盛出，再炒番茄出汁后合炒调味）、蒜蓉炒西兰花（西兰花焯水，蒜末爆香后翻炒调味）、酸辣土豆丝（土豆切丝泡水去淀粉，热油爆干辣椒和花椒，下土豆丝翻炒加醋盐调味）、青椒肉丝（肉丝腌制上浆，青椒切丝，先滑炒肉丝盛出，再炒青椒合炒调味）、西红柿豆腐汤（番茄煸炒出汁加水煮开，下豆腐块煮几分钟调味撒葱花）等。每道菜说明所需食材和详细做法步骤即可。",
  "metadata": {
    "source": "MiniMax-M3@minimax-cn",
    "license": "internal",
    "task_type": "no_tool",
    "data_version": "D1.1",
    "pipeline_version": "d1.1-llm-generator",
    "created_at": "2026-08-27T00:00:00Z",
    "validation": {
      "schema_valid": true
    }
  }
}
