{
  "schema_version": "1.0",
  "id": "d1llm-train-0092",
  "messages": [
    {
      "role": "user",
      "content": "帮我算一下（3.5+2.4）×1.8-7.2÷0.6的结果是多少？"
    }
  ],
  "tools": [
    {
      "type": "function",
      "function": {
        "name": "d1_calculate",
        "description": "计算简单算术表达式（整数），返回整数结果。",
        "parameters": {
          "type": "object",
          "properties": {
            "expression": {
              "type": "string"
            }
          },
          "required": [
            "expression"
          ]
        }
      }
    },
    {
      "type": "function",
      "function": {
        "name": "d1_get_weather",
        "description": "查询指定城市当前天气，返回天气字符串。",
        "parameters": {
          "type": "object",
          "properties": {
            "city": {
              "type": "string"
            }
          },
          "required": [
            "city"
          ]
        }
      }
    },
    {
      "type": "function",
      "function": {
        "name": "d1_web_search",
        "description": "搜索网络信息，返回搜索摘要。",
        "parameters": {
          "type": "object",
          "properties": {
            "query": {
              "type": "string"
            },
            "limit": {
              "type": "integer",
              "minimum": 1
            }
          },
          "required": [
            "query"
          ]
        }
      }
    }
  ],
  "expected_tool_calls": [
    {
      "call_id": "c1",
      "name": "d1_calculate",
      "arguments": {
        "expression": "(3.5+2.4)*1.8-7.2/0.6"
      },
      "depends_on": [],
      "expected_result": -1
    }
  ],
  "expected_answer": "(3.5+2.4)×1.8-7.2÷0.6 的结果是 1.62。",
  "metadata": {
    "source": "MiniMax-M3@2026-08-27",
    "license": "internal",
    "task_type": "single_tool",
    "data_version": "D1.1",
    "pipeline_version": "d1.1-llm-generator",
    "created_at": "2026-08-27T00:00:00Z",
    "validation": {
      "schema_valid": true
    }
  }
}
