{
  "schema_version": "1.0",
  "id": "d1llm-train-0417",
  "messages": [
    {
      "role": "user",
      "content": "帮我查一下北京明天的天气，再根据天气情况算算适合户外跑步的时长。"
    }
  ],
  "tools": [
    {
      "type": "function",
      "function": {
        "name": "d1_calculate",
        "description": "计算简单算术表达式（整数），返回整数结果。",
        "parameters": {
          "type": "object",
          "properties": {
            "expression": {
              "type": "string"
            }
          },
          "required": [
            "expression"
          ]
        }
      }
    },
    {
      "type": "function",
      "function": {
        "name": "d1_get_weather",
        "description": "查询指定城市当前天气，返回天气字符串。",
        "parameters": {
          "type": "object",
          "properties": {
            "city": {
              "type": "string"
            }
          },
          "required": [
            "city"
          ]
        }
      }
    },
    {
      "type": "function",
      "function": {
        "name": "d1_web_search",
        "description": "搜索网络信息，返回搜索摘要。",
        "parameters": {
          "type": "object",
          "properties": {
            "query": {
              "type": "string"
            },
            "limit": {
              "type": "integer",
              "minimum": 1
            }
          },
          "required": [
            "query"
          ]
        }
      }
    }
  ],
  "expected_tool_calls": [
    {
      "call_id": "c1",
      "name": "d1_get_weather",
      "arguments": {
        "city": "北京"
      },
      "depends_on": [],
      "expected_result": "北京 当前天气：晴，22°C，微风。"
    },
    {
      "call_id": "c2",
      "name": "d1_calculate",
      "arguments": {
        "expression": "30"
      },
      "depends_on": [
        "c1"
      ],
      "expected_result": 30
    }
  ],
  "expected_answer": "北京明天天气情况已查询，根据天气状况给出适合户外跑步的时长建议（一般为30分钟左右）。",
  "metadata": {
    "source": "MiniMax-M3@minimax-cn",
    "license": "internal",
    "task_type": "multi_tool",
    "data_version": "D1.1",
    "pipeline_version": "d1.1-llm-generator",
    "created_at": "2026-08-27T00:00:00Z",
    "validation": {
      "schema_valid": true
    }
  }
}
