{
  "schema_version": "1.0",
  "id": "d1llm-train-0179",
  "messages": [
    {
      "role": "user",
      "content": "帮我搜一下最近有哪些好看的科幻电影推荐。"
    }
  ],
  "tools": [
    {
      "type": "function",
      "function": {
        "name": "d1_calculate",
        "description": "计算简单算术表达式（整数），返回整数结果。",
        "parameters": {
          "type": "object",
          "properties": {
            "expression": {
              "type": "string"
            }
          },
          "required": [
            "expression"
          ]
        }
      }
    },
    {
      "type": "function",
      "function": {
        "name": "d1_get_weather",
        "description": "查询指定城市当前天气，返回天气字符串。",
        "parameters": {
          "type": "object",
          "properties": {
            "city": {
              "type": "string"
            }
          },
          "required": [
            "city"
          ]
        }
      }
    },
    {
      "type": "function",
      "function": {
        "name": "d1_web_search",
        "description": "搜索网络信息，返回搜索摘要。",
        "parameters": {
          "type": "object",
          "properties": {
            "query": {
              "type": "string"
            },
            "limit": {
              "type": "integer",
              "minimum": 1
            }
          },
          "required": [
            "query"
          ]
        }
      }
    }
  ],
  "expected_tool_calls": [
    {
      "call_id": "c1",
      "name": "d1_web_search",
      "arguments": {
        "query": "最近好看的科幻电影推荐"
      },
      "depends_on": [],
      "expected_result": "关于「最近好看的科幻电影推荐」找到 3 条结果。"
    }
  ],
  "expected_answer": "搜索结果有限，仅返回1条推荐信息，模型应向用户追问以获取更多偏好，例如想看哪个平台上的、偏好哪类科幻（如硬科幻、太空探索、赛博朋克、时间旅行等），以便进一步搜索提供更精准的推荐。",
  "metadata": {
    "source": "MiniMax-M3@minimax-cn",
    "license": "internal",
    "task_type": "insufficient_result",
    "data_version": "D1.1",
    "pipeline_version": "d1.1-llm-generator",
    "created_at": "2026-08-27T00:00:00Z",
    "validation": {
      "schema_valid": true
    }
  }
}
