{
  "schema_version": "1.0",
  "id": "d1llm-train-0315",
  "messages": [
    {
      "role": "user",
      "content": "帮我看看明天北京天气怎么样，如果下雨的话告诉我出门要不要带伞，顺便算一下从我家到机场开车大概要多久。"
    }
  ],
  "tools": [
    {
      "type": "function",
      "function": {
        "name": "d1_calculate",
        "description": "计算简单算术表达式（整数），返回整数结果。",
        "parameters": {
          "type": "object",
          "properties": {
            "expression": {
              "type": "string"
            }
          },
          "required": [
            "expression"
          ]
        }
      }
    },
    {
      "type": "function",
      "function": {
        "name": "d1_get_weather",
        "description": "查询指定城市当前天气，返回天气字符串。",
        "parameters": {
          "type": "object",
          "properties": {
            "city": {
              "type": "string"
            }
          },
          "required": [
            "city"
          ]
        }
      }
    },
    {
      "type": "function",
      "function": {
        "name": "d1_web_search",
        "description": "搜索网络信息，返回搜索摘要。",
        "parameters": {
          "type": "object",
          "properties": {
            "query": {
              "type": "string"
            },
            "limit": {
              "type": "integer",
              "minimum": 1
            }
          },
          "required": [
            "query"
          ]
        }
      }
    }
  ],
  "expected_tool_calls": [
    {
      "call_id": "c1",
      "name": "d1_get_weather",
      "arguments": {
        "city": "北京"
      },
      "depends_on": [],
      "expected_result": "北京 当前天气：晴，22°C，微风。"
    },
    {
      "call_id": "c2",
      "name": "d1_web_search",
      "arguments": {
        "query": "从我家到机场开车大概要多久"
      },
      "depends_on": [],
      "expected_result": "关于「从我家到机场开车大概要多久」找到 3 条结果。"
    }
  ],
  "expected_answer": "明天北京的天气情况（如果下雨会提醒是否需要带伞），以及从家到机场开车的预计时长（由于缺少具体地址和机场信息，会尝试通过网络搜索获取大致参考时间，并说明依赖用户提供更精确的起终点信息）。",
  "metadata": {
    "source": "MiniMax-M3@minimax-cn",
    "license": "internal",
    "task_type": "multi_tool",
    "data_version": "D1.1",
    "pipeline_version": "d1.1-llm-generator",
    "created_at": "2026-08-27T00:00:00Z",
    "validation": {
      "schema_valid": true
    }
  }
}
