{
  "schema_version": "1.0",
  "id": "d1llm-train-0333",
  "messages": [
    {
      "role": "user",
      "content": "帮我查一下北京现在的天气，然后算算30度的气温乘以5等于多少华氏度，最后再搜一下下周末北京会不会降温。"
    }
  ],
  "tools": [
    {
      "type": "function",
      "function": {
        "name": "d1_calculate",
        "description": "计算简单算术表达式（整数），返回整数结果。",
        "parameters": {
          "type": "object",
          "properties": {
            "expression": {
              "type": "string"
            }
          },
          "required": [
            "expression"
          ]
        }
      }
    },
    {
      "type": "function",
      "function": {
        "name": "d1_get_weather",
        "description": "查询指定城市当前天气，返回天气字符串。",
        "parameters": {
          "type": "object",
          "properties": {
            "city": {
              "type": "string"
            }
          },
          "required": [
            "city"
          ]
        }
      }
    },
    {
      "type": "function",
      "function": {
        "name": "d1_web_search",
        "description": "搜索网络信息，返回搜索摘要。",
        "parameters": {
          "type": "object",
          "properties": {
            "query": {
              "type": "string"
            },
            "limit": {
              "type": "integer",
              "minimum": 1
            }
          },
          "required": [
            "query"
          ]
        }
      }
    }
  ],
  "expected_tool_calls": [
    {
      "call_id": "c1",
      "name": "d1_get_weather",
      "arguments": {
        "city": "北京"
      },
      "depends_on": [],
      "expected_result": "北京 当前天气：晴，22°C，微风。"
    },
    {
      "call_id": "c2",
      "name": "d1_calculate",
      "arguments": {
        "expression": "30*5"
      },
      "depends_on": [],
      "expected_result": 150
    },
    {
      "call_id": "c3",
      "name": "d1_web_search",
      "arguments": {
        "query": "下周末北京会不会降温"
      },
      "depends_on": [],
      "expected_result": "关于「下周末北京会不会降温」找到 3 条结果。"
    }
  ],
  "expected_answer": "北京现在的天气情况需要通过天气工具查询；30度乘以5等于150（摄氏度数值运算，因子5无单位换算意义）；下周末北京是否会降温需要通过搜索查询最新预报信息综合回答。",
  "metadata": {
    "source": "MiniMax-M3@minimax-cn",
    "license": "internal",
    "task_type": "multi_tool",
    "data_version": "D1.1",
    "pipeline_version": "d1.1-llm-generator",
    "created_at": "2026-08-27T00:00:00Z",
    "validation": {
      "schema_valid": true
    }
  }
}
