{
  "schema_version": "1.0",
  "id": "d1llm-train-1437",
  "messages": [
    {
      "role": "user",
      "content": "帮我查一下北京今天的天气，然后根据天气情况算算出门跑步消耗的热量需要补充多少水。"
    }
  ],
  "tools": [
    {
      "type": "function",
      "function": {
        "name": "d1_calculate",
        "description": "计算简单算术表达式（整数），返回整数结果。",
        "parameters": {
          "type": "object",
          "properties": {
            "expression": {
              "type": "string"
            }
          },
          "required": [
            "expression"
          ]
        }
      }
    },
    {
      "type": "function",
      "function": {
        "name": "d1_get_weather",
        "description": "查询指定城市当前天气，返回天气字符串。",
        "parameters": {
          "type": "object",
          "properties": {
            "city": {
              "type": "string"
            }
          },
          "required": [
            "city"
          ]
        }
      }
    },
    {
      "type": "function",
      "function": {
        "name": "d1_web_search",
        "description": "搜索网络信息，返回搜索摘要。",
        "parameters": {
          "type": "object",
          "properties": {
            "query": {
              "type": "string"
            },
            "limit": {
              "type": "integer",
              "minimum": 1
            }
          },
          "required": [
            "query"
          ]
        }
      }
    }
  ],
  "expected_tool_calls": [
    {
      "call_id": "c1",
      "name": "d1_get_weather",
      "arguments": {
        "city": "北京"
      },
      "depends_on": [],
      "expected_result": "北京 当前天气：晴，22°C，微风。"
    },
    {
      "call_id": "c2",
      "name": "d1_calculate",
      "arguments": {
        "expression": "500*0.8"
      },
      "depends_on": [],
      "expected_result": 400
    }
  ],
  "expected_answer": "先查询北京今天的天气情况，然后根据天气（温度、湿度等）计算跑步消耗热量所需补充的水分。一般建议每消耗1千卡热量补充约0.8~1毫升水，若按跑步30分钟约消耗300~500千卡计算，建议补充约240~500毫升水（约1~2杯）。",
  "metadata": {
    "source": "MiniMax-M3@minimax-cn",
    "license": "internal",
    "task_type": "multi_tool",
    "data_version": "D1.1",
    "pipeline_version": "d1.1-llm-generator",
    "created_at": "2026-08-27T00:00:00Z",
    "validation": {
      "schema_valid": true
    }
  }
}
