{
  "schema_version": "1.0",
  "id": "d1llm-train-0143",
  "messages": [
    {
      "role": "user",
      "content": "帮我搜一下最近有什么好看的科幻电影推荐，就一条也行，不过我想多了解几部，能不能再找找别的相关信息？"
    }
  ],
  "tools": [
    {
      "type": "function",
      "function": {
        "name": "d1_calculate",
        "description": "计算简单算术表达式（整数），返回整数结果。",
        "parameters": {
          "type": "object",
          "properties": {
            "expression": {
              "type": "string"
            }
          },
          "required": [
            "expression"
          ]
        }
      }
    },
    {
      "type": "function",
      "function": {
        "name": "d1_get_weather",
        "description": "查询指定城市当前天气，返回天气字符串。",
        "parameters": {
          "type": "object",
          "properties": {
            "city": {
              "type": "string"
            }
          },
          "required": [
            "city"
          ]
        }
      }
    },
    {
      "type": "function",
      "function": {
        "name": "d1_web_search",
        "description": "搜索网络信息，返回搜索摘要。",
        "parameters": {
          "type": "object",
          "properties": {
            "query": {
              "type": "string"
            },
            "limit": {
              "type": "integer",
              "minimum": 1
            }
          },
          "required": [
            "query"
          ]
        }
      }
    }
  ],
  "expected_tool_calls": [
    {
      "call_id": "c1",
      "name": "d1_web_search",
      "arguments": {
        "query": "最近好看的科幻电影推荐",
        "limit": 1
      },
      "depends_on": [],
      "expected_result": "关于「最近好看的科幻电影推荐」找到 1 条结果。"
    }
  ],
  "expected_answer": "已搜索到1条科幻电影推荐信息，但用户希望多了解几部，应向用户反馈：当前仅返回了一条结果，想再找几部不同风格的科幻电影，需要用户进一步说明偏好（如硬科幻、太空歌剧、赛博朋克、末日题材等），或是否有特定的导演/演员偏好，以便继续搜索补充。",
  "metadata": {
    "source": "MiniMax-M3@minimax-cn",
    "license": "internal",
    "task_type": "insufficient_result",
    "data_version": "D1.1",
    "pipeline_version": "d1.1-llm-generator",
    "created_at": "2026-08-27T00:00:00Z",
    "validation": {
      "schema_valid": true
    }
  }
}
